{
    "random_seed": 42,
    "simulation_timestep": 0.001,
    "neuron_count": 1000,
    "region_count": 2,
    "connection_probability": 0.1,
    "plasticity_learning_rate": 0.01,
    "stdp_ltp_weight": 0.01,
    "stdp_ltd_weight": 0.012,
    "stdp_time_constant": 20.0,
    "development_synaptogenesis_rate": 0.001,
    "development_pruning_rate": 0.0001,
    "dopamine_baseline": 0.0,
    "reward_discount_factor": 0.99,
    "environment_name": "GridWorld",
    "environment_width": 10,
    "environment_height": 10,
    "log_level": "INFO",
    "log_to_file": false,
    "log_filename": "nlm.log",
    "max_simulation_steps": 10000,
    "simulation_time_limit": 0.0,
    "visualization_enabled": false,
    "visualization_update_rate": 30.0
}